elapsed,633317,1617234616075,intermediate
47WHTWBB4F6Q,ball,the batter did not swing and the umpire called the pitch a ball.
23BXWGB4MSAH,foul,the batter hit the ball however the ball was not in play, it was out of bounds
FPU1ALRRBY0N,play,the hitter hit the ball, it was in bounds and the hitter made it safe to 1st base
9LT7RCBI8BH5,strike,the batter took a swing at the pitch, he missed so therefore it was a strike
IJKIU05QXV7H,foul,the hitter hit the ball however it was out of bounds
J4DIZ8GMXBKW,foul,the hitter hit the ball but it was out of bounds
2NA4MHNRBE9U,out,the hitter hit the ball and the ball was caught by a player in the outfield
G0TNP1HSDNX3,strike,the hitter took a swing at the ball but he missed
OGY7H7XXM0U1,foul,the hitter hit the ball but it was out of bounds
41Z69C8Q1NR7,out,the hitter hit the ball but it was caught by the left fielder
