elapsed,255338,1619126101905,advanced
D89AEK8UXYV5,foul,then the batter hit it out of bounds. 
DG86NY5US67J,strike,then the umpire ruled it as a strike. 
I0QY7T24CTTI,strike,then the batter swung and missed. 
LWHY4CP7A7BS,strike,then the umpire ruled it as a strike. 
MNGMTZ7XFUV3,ball,it was out of the strike zone. 
RQN9BSCCFZ6O,play,then the batter hit it on the ground. 
ZT6E6KV9YB4Q,strike,the batter swung and missed. 
X383F4293LUY,ball,it was out of the strike zone. 
3PG9QN2MCUB0,out,then it was hit in the air and caught. 
QGTTOU8CVOG8,out,it was hit into the air and caught by an outfielder. 
