elapsed,287342,1619134530077,advanced
NW20RKBBPAIX,ball,The pitch did not cross the plate inside of the strike zone, the batter did not swing, and the pitch was called a ball by the umpire.
BLVFLKTBGUGP,out,The batter hit the ball to the outfield where it was caught in the air by the center fielder.
NGO5NMYWD2QB,ball,The pitch did not cross the plate inside of the strike zone, the batter did not swing, and the pitch was called a ball by the umpire.
4QPRTKPYL858,out,The batter hit the ball to the outfield where it was caught in the air by the right fielder.
R09WPPKCYRMJ,play,The batter hit the ball into the outfield where it bounced off the wall for a hit.
9U67UYCIYA75,ball,The pitch did not cross the plate inside of the strike zone, the batter did not swing, and the pitch was called a ball by the umpire.
87WVQ8MJV6AB,strike,The batter swung and missed for a strike.
PUFBGREQC436,out,The batter hit a line drive to the second baseman who caught the ball in the air.
EUE0X2I4USPR,strike,The ball crossed the plate inside the strike zone and was called a strike by the umpire.
10ODZPLPJR1U,play,The batter hit the ball on the ground to the second baseman.
