elapsed,795325,1619291986683,intermediate
6WBL9G9QUQT7,ball,the umpire did not call it a strike
QY1T0U8H5SR6,foul,ball was hit out of bounds
7F0T5YP684G5,play,ball was hit into the outfield
IJJHE4LLFDNK,strike,the batter swung
YO21SMDKHEZ0,foul,ball went outside the 3rd base line
O7B3HXXJWT3F,strike,the umpire called the ball a strike
6X6FAHGVQURW,foul,ball was hit out of bounds
VL0L2H9HFYRU,out,the ball was caught by the out fielder
YF11BLVZJV4P,strike,batter swung and missed
9FGH7JM6K6R5,out,short stop caught the ball in the air
