elapsed,394100,1617054775203,intermediate
Q23KTQYOIKH6,play,HE HIT IT ON THE GROUND, BUT THE SIDE GOT OUT BECAUSE THEY THREW IT TO SECOND AND GOT THE RUNNER OUT.
LX9VYLTIPMXP,play,THE BATTER HIT AN OUT OF THE PARK HOME RUN
PLUK23M3LQ5I,foul,HE HIT A FOUL
GU0MN404DYUH,play,HE HIT A GROUND BALL TO SHORT STOP AND WAS THROWN OUT AT FIRST
CLLMEZHHZJ6Z,play,HE HIT AN OUT OF THE PARK HOME RUN
XEV8MJ3QUKVF,ball,IT WAS INSIDE AND COUNTED AS A BALL.
HC76KX8LM5MO,ball,THREW IT OUTSIDE FOR A BALL
SF06MAKDUNNP,strike,THE BATTER DID NOT TRY TO HIT IT
I3VNLEORMYBK,play,HIT IT TO CENTER FIELD AND GOT ON FIRST BASE
042VO7A7LTR9,ball,IT WAS ON THE OUTSIDE
