elapsed,221982,1617233541731,advanced
LSDLO2708UJF,out,The batter hit the ball in the air where it was caught by the pitcher.
FQZTKPZ4COYY,play,The batter hit the ball on the ground to the third baseman.
J8MRXZIL1O86,play,The batter hit the ball on the ground to the third baseman.
UHAG8C56T2GH,ball,The ball did not cross the plate inside of the strike zone and was called a ball by the umpire.
6LD076UTRHKP,foul,The batter hit the ball out of play for a foul ball.
VU48HQ3YABHK,play,The batter hit the ball down the left field line for a hit.
818KAF8EWDXO,strike,the pitch was called a strike by the umpire.
6ALGS4E4EOMS,foul,The batter hit the ball out of play for a foul ball.
G8H6HULCACQZ,none,The video did not load.
WZ6TSCKAIT0Q,strike,the batter swung and missed.
