elapsed,211965,1617233573729,advanced
32B16ECLHOQR,out,the player hit it to the outfield and the player caught it.
L04F9IFEDUHG,strike,it landed in the strike zone.
Q20E0OW6YIKL,strike,The pitcher threw it in the strike zone.
HITKM03O9NOZ,none,video did not load.
K3YS1O7DZA0W,ball,Ball outside.
AIMO9I4K7PJR,strike,He checked the swing but went too far.
G9XPQQCPGY6N,foul,Out of play.. foul ball.
JA1LG8D5ST6E,foul,fall ball. Out of play.
6QW8L3YIL24T,foul,foul ball.
8NSQ2K4XEYO1,play,hit to the opposite field.
